aiter/ops/triton/configs/gemm/gfx950-GEMM-A16W16-ATOMIC.json
{
    "M_LEQ_4": {
        "BLOCK_SIZE_M": 16,
        "BLOCK_SIZE_N": 32,
        "BLOCK_SIZE_K": 128,
        "GROUP_SIZE_M": 1,
        "NUM_KSPLIT": 16,
        "cache_modifier": ".cg",
        "num_warps": 4,
        "num_stages": 1,
        "waves_per_eu": 4,
        "matrix_instr_nonkdim": 16,
        "kpack": 1
    },
    "M_LEQ_8": {
        "BLOCK_SIZE_M": 16,
        "BLOCK_SIZE_N": 32,
        "BLOCK_SIZE_K": 128,
        "GROUP_SIZE_M": 1,
        "NUM_KSPLIT": 16,
        "cache_modifier": ".cg",
        "num_warps": 4,
        "num_stages": 1,
        "waves_per_eu": 4,
        "matrix_instr_nonkdim": 16,
        "kpack": 1
    },
    "M_LEQ_16": {
        "BLOCK_SIZE_M": 32,
        "BLOCK_SIZE_N": 128,
        "BLOCK_SIZE_K": 64,
        "GROUP_SIZE_M": 1,
        "NUM_KSPLIT": 4,
        "cache_modifier": ".cg",
        "num_warps": 4,
        "num_stages": 2,
        "waves_per_eu": 4,
        "matrix_instr_nonkdim": 16,
        "kpack": 2
    },
    "M_LEQ_32": {
        "BLOCK_SIZE_M": 64,
        "BLOCK_SIZE_N": 128,
        "BLOCK_SIZE_K": 64,
        "GROUP_SIZE_M": 4,
        "NUM_KSPLIT": 2,
        "cache_modifier": null,
        "num_warps": 4,
        "num_stages": 2,
        "waves_per_eu": 4,
        "matrix_instr_nonkdim": 16,
        "kpack": 2
    },
    "M_LEQ_64": {
        "BLOCK_SIZE_M": 64,
        "BLOCK_SIZE_N": 256,
        "BLOCK_SIZE_K": 64,
        "GROUP_SIZE_M": 4,
        "NUM_KSPLIT": 1,
        "cache_modifier": null,
        "num_warps": 8,
        "num_stages": 2,
        "waves_per_eu": 4,
        "matrix_instr_nonkdim": 32,
        "kpack": 1
    },
    "any": {
        "BLOCK_SIZE_M": 256,
        "BLOCK_SIZE_N": 256,
        "BLOCK_SIZE_K": 64,
        "GROUP_SIZE_M": 4,
        "NUM_KSPLIT": 1,
        "cache_modifier": null,
        "num_warps": 8,
        "num_stages": 2,
        "waves_per_eu": 2,
        "matrix_instr_nonkdim": 32,
        "kpack": 1
    }
}
